ID|Date|Company|Title|Location|Description|sub|Link
|2021-10-29|LBMC|Cybersecurity Analyst|Nashville, TN|"LBMC Information Security/CyberMaxx is looking for individuals who are passionate about Security! Do you stay up at night thinking about vulnerabilities and attack scenarios? Do you enjoy working with and leading a team of software security professionals to creatively secure and maintain an enterprise product? If so, LBMC is currently searching for an analyst to work in our 24/7 Security Operations Center (SOC). You will be on the leading edge of analyzing and responding to today's most current cyber-attacks.  DAILY DUTIES  Work as part of a team to deliver services to clients, as well as the following:  First level analysis of real-time intrusion detection (IDS) & log monitoring systems (SIEM) Communication of issues to clients General analysis & reporting of activities   Qualifications  2+ years Information Technology experience required Analytical mindset & aptitude to learn quickly Reliable & willing to work in a 24/7 operations center (shift work required) Solid understanding of core security and infrastructure technologies, such as: firewall, VPN, IDS/IPS/SIEM, Anti-virus, E-mail, DNS, Microsoft OS, & Linux OS Basic understanding of TCP/IP networking, such as: IP addressing, subnet masks, basic IP routing, TCP/UDP   EDUCATION | CERTIFICATIONS  BS degree in Engineering, Computer Science, Information Security, or Information Systems preferred Professional certifications such as Security+, Network+, CCNA   Powered by JazzHR  omE2oamv11"|{'Seniority level': 'Mid-Senior level', 'Employment type': 'Full-time', 'Job function': 'Information Technology', 'Industries': 'IT Services and IT Consulting, Financial Services, and Accounting', 'error': ''}|https://www.linkedin.com/jobs/view/cybersecurity-analyst-at-lbmc-2809742719?refId=dgoWN%2B9sLbbjKvV9xyvPzg%3D%3D&trackingId=q2fWq5ftR6RTm6iIMHYY1g%3D%3D&position=1&pageNum=0&trk=public_jobs_jserp-result_search-card
|2021-11-18|Vanderbilt University Medical Center|Threat Detection & Response Analyst|Nashville, TN|Job Summary  The Threat Detection & Response Analyst c onducts computer and network intrusion detection, incident response, forensic investigations, data recovery and electronic discovery under occasional guidance. The Threat Detection & Response Analyst c onducts small and medium scale threat analysis for the environment. Troubleshoots and resolves complex security issues. Implements small and medium technology projects or components of large projects. Ability to solve medium to complex problems.  Key Responsibilities  Performs intrusion detection and incident response. Conducts computer investigations. Conducts threat analysis for the environment. The responsibilities listed are a general overview of the position and additional duties may be assigned.  Technical Capabilities  ANOMALY AND INTRUSION DETECTION (NOVICE): Possesses sufficient fundamental proficiency to successfully demonstrate Intrusion and Anomaly Detection practices in practical applications of moderate difficulty. Has a basic understanding of network behavior analysis techniques and tools. Capable of using various detection systems and software.  INCIDENT RESPONSE (NOVICE): Demonstrates the ability to respond quickly to reports from individuals. Takes immediate action to stop a cybersecurity incident from continuing or recurring. Determines whether an incident should be handled locally or reported to the IT Security Response Team. Works with the IT support staff to repair a system, restore service, and preserve evidence of the incident. Handles sensitive and other critical responses in a professional manner. Evaluates and documents investigation findings after resolving an incident. Capable of using various computer forensic systems and software.  MALWARE ANALYSIS (NOVICE): Possesses sufficient fundamental proficiency to successfully demonstrate Malware Analysis in practical applications of moderate difficulty. Has determined the behavior and purpose of a simple malware threat and eliminated it from the Company's computers. Familiar with Dynamic Analysis, the analysis of software during its execution on a computer or in a virtual machine, and Static Analysis, the method to look at the component without any execution on the component itself. Has used basic Malware Analysis tools and products.  NETWORK AND SYSTEMS FORENSICS (NOVICE): Possesses sufficient fundamental proficiency to successfully demonstrate Digital Forensics capability on system and network data in practical applications of moderate difficulty.  THREAT DATA (NOVICE): Proficient to review and collect pertinent Indicators of Compromise and other threat data from available sources (feeds, community communications, etc) to feed into existing Intrusion Detection systems and processes, to enhance discovery of threats in the environment.  SECURITY POSTURE ASSESSMENT (NOVICE): Demonstrates the ability to successfully review basic Internet connections and internal networks to identify standard hacker/cracker threats. Able to review the configuration of server and major network applications to identify configuration errors and other problems that weaken organizational systems and increase their likelihood of misuse. Has conducted an assessment of at least one of the following: [1] access controls, governing access to applications and files, [2] password controls, determining permissible choice of passwords and governing the requirement to change passwords, [3] connectivity controls [e.g., open ports/ enabled protocols] influencing permissible communications to and from a computer system, [4] inappropriate files [including viruses, worms, Trojan horses, bootleg software, music files, inappropriate image files], and [5] unpatched software, bringing attention to available security-related patches that have not been deployed. Has basic knowledge of several of the following: network foot-printing, port scanning, and enumeration techniques, specific operating system vulnerabilities [like Win-NT, *nix,Win-2K, Solaris], web server vulnerabilities, application level exploits, worms, viruses, and Trojans, network vulnerabilities, sniffing, wireless sniffing, IP spoofing, and PPTP/VPN breaking. Generate security reports for management that show system safety and incident reporting.  Core Accountabilities  Organizational Impact: Executes job responsibilities with the understanding of how output would affect and impact other areas related to own job area/team with occasional guidance. Problem Solving/ Complexity of work: Analyzes moderately complex problems using technical experience and judgment. Breadth of Knowledge: Has expanded knowledge gained through experience within a professional area. Team Interaction: Provides informal guidance and support to team members.  About The Department  VUMC IT  VUMC IT provides hardware, software and service solutions for the entire Medical Center. With over 40,000 workstations in the Medical Center, our teams can assist not only with hardware support, but also software and application support and services to enhance security and protection of your information.  Position Shift: Days  Discover Vanderbilt University Medical Center  Located in Nashville, Tennessee, and operating at a global crossroads of teaching, discovery and patient care, VUMC is a community of individuals who come to work each day with the simple aim of changing the world. It is a place where your expertise will be valued, your knowledge expanded, and your abilities challenged. It is a place where your diversity — of culture, thinking, learning and leading — is sought and celebrated. It is a place where employees know they are part of something that is bigger than themselves, take exceptional pride in their work and never settle for what was good enough yesterday. Vanderbilt’s mission is to advance health and wellness through preeminent programs in patient care, education, and research.  VUMC Recent Accomplishments  Education  Because we are committed to providing the best in patient care, education and research, we are proud of our recent accomplishments  US News & World Report: #1 Adult Hospital in Tennessee and metropolitan Nashville, named to the Best Hospitals Honor Roll of the top 20 adult hospitals, 10 nationally ranked adult specialty programs, with 3 specialties rated in the top 10 nationally, Monroe Carell Jr. Children’s Hospital at Vanderbilt named as one of the Best Children’s Hospital in the nation, with 10 out of 10 pediatric specialties nationally ranked. Healthcare’s Most Wired: Among the nation’s 100 “most-wired” hospitals and health systems for its efforts in innovative medical technology. Becker’s Hospital Review: named as one of the “100 Great Hospitals in America”, in the roster of 100 Hospitals and Health Systems with Great Oncology Programs and to its list of the 100 Hospitals with Great Heart Programs. The Leapfrog Group: One of only 10 children’s hospitals in the to be named at Leapfrog Top Hospital. American Association for the Advancement of Science: The School of Medicine has 112 elected fellows Magnet Recognition Program: Received our third consecutive Magnet designations. National Academy of Medicine: 22 members, elected by their peers in recognition of outstanding achievement Human Rights Campaign Healthcare Equality Index: 6 th year in a row that Vanderbilt University Medical Center was a Leader in LGBTQ Healthcare Equality.  Job  Information Technology  Primary Location  TN-Nashville-3401 West End Ave  Organization  VEC Security Operations & Svcs 108042  Shift  Days  Position Qualifications  Bachelor's Degree (or equivalent experience) and 2 years relevant experience  Physical Requirements/Strengths Needed & Physical Demands  Sedentary category requiring exertion up to 10 lbs. of force occasionally and uses negligible amounts of force to move objects. Sedentary work involves sitting most of the time.  Movement  Occasional: Standing: Remaining on one's feet without moving. Occasional: Walking: Moving about on foot. Occasional: Lifting under 35 lbs: Raising and lowering objects under 35 lbs from one level to another Occasional: Carrying under 35 lbs: Transporting an object holding in hands, arms or shoulders, with help of coworkers or assistive device. Occasional: Bending/Stooping: Trunk bending downward and forward by bending spine at waist requiring full use of lower extremities and back muscles Occasional: Reaching above shoulders: Extending arms in any direction above shoulders. Frequent: Sitting: Remaining in seated position Frequent: Reaching below shoulders: Extending arms in any direction below shoulders. Frequent: Fingering: Picking, pinching, gripping, working primarily with fingers requiring fine manipulation. Frequent: Bimanual Dexterity: Requiring the use of both hands.  Sensory  Continuous: Communication: Expressing or exchanging written/verbal/electronic information. Continuous: Auditory: Perceiving the variances of sounds, tones and pitches and able to focus on single source of auditory information Continuous: Vision: Clarity of near vision at 20 inches or less and far vision at 20 feet or more with depth perception, peripheral vision, color vision. Continuous: Smell: Ability to detect and identify odors.  Environmental Conditions|{'Seniority level': 'Entry level', 'Employment type': 'Full-time', 'Job function': 'Information Technology', 'Industries': 'Non-profit Organizations, Wellness and Fitness Services, and Hospitals and Health Care', 'error': ''}|https://www.linkedin.com/jobs/view/threat-detection-response-analyst-at-vanderbilt-university-medical-center-2804388777?refId=dgoWN%2B9sLbbjKvV9xyvPzg%3D%3D&trackingId=aazQE8SlDzRXrf4uC20kAg%3D%3D&position=2&pageNum=0&trk=public_jobs_jserp-result_search-card
|2021-11-17|U.S. Bank|Information Security Risk & Compliance Integrated Testing & Assessments - Remote|Nashville, TN|At U.S. Bank, we're passionate about helping customers and the communities where we live and work. The fifth-largest bank in the United States, we’re one of the country's most respected, innovative and successful financial institutions. U.S. Bank is an equal opportunity employer committed to creating a diverse workforce. We consider all qualified applicants without regard to race, religion, color, sex, national origin, age, sexual orientation, gender identity, disability or veteran status, among other factors.  Job Description  The Information Security Integrated Testing and Assessments Specialist will contribute significantly to a dynamic team that provides oversight and analytics along with operational support for the Information Security Services organization’s RSA Archer “Metrics” system. This individual will partner with TOS Information Security Services (ISS) teams and Operational Risk Management partners in providing metrics, analytics and reporting using the Archer toolset. The main functional goal of this individual includes delivering monthly, quarterly, and annual reporting results and themes.These activities provide oversight to support and improve the Bank’s ISS testing and assessment activities as well as enhancing existing solutions that have already been deployed.  Activities include research, planning, design, development, implementation and reporting on ISS testing and assessments supporting the ORM Data Protection & Privacy program. This includes the coordination, monitoring and reporting of process activities (via metrics) essential in demonstrating the ISS activities through performance and risk indicators. This key player must be able to drive and execute the overall execution of the initiatives, data needs, champion best practices and lead quality improvement projects.  Job Duties And Responsibilities Include  Manage and support the collaboration, analytics, reporting of ISS testing and assessments Provide subject matter expertise and business use cases in technology enhancements with the tool(s) used to support Information Security Integrated Testing and Assessments program Perform analytics and collaborate with testing and assessment subject matter experts for streamlined reporting and results Support, manage, and ensure adequate coverage of corporate information security policies with information security legal requirements, regulatory mandates, and related industry benchmarks Support information security related exams, audits, customer requests, and business line needs  Basic Qualifications  Bachelor of Science or equivalent experience 5 or more years’ experience in Information Security, information security regulatory compliance, project management and/or legal compliance  Preferred Skills/Experience  RSA Archer Administration/User ServiceNow Administration/User 2 or more years’ experience in analytics and report writing Strong communication skills including written and verbal Presentation skills Problem-solving  Benefits  Take care of yourself and your family with U.S. Bank employee benefits. We know that healthy employees are happy employees, and we believe that work/life balance should be easy to achieve. That's why we share the cost of benefits and offer a variety of programs, resources and support you need to bring your full self to work and stay present and committed to the people who matter most - your family.  Learn all about U.S. Bank employee benefits, including tuition reimbursement, retirement plans and more, by visiting usbank.com/careers .  EEO is the Law  Applicants can learn more about the company’s status as an equal opportunity employer by viewing the federal EEO is the Law poster.  E-Verify  U.S. Bank participates in the U.S. Department of Homeland Security E-Verify program in all facilities located in the United States and certain U.S. territories. The E-Verify program is an Internet-based employment eligibility verification system operated by the U.S. Citizenship and Immigration Services. Learn more about the E-Verify program .|{'Seniority level': 'Entry level', 'Employment type': 'Full-time', 'Job function': 'Information Technology', 'Industries': 'IT Services and IT Consulting, Banking, and Financial Services', 'error': ''}|https://www.linkedin.com/jobs/view/information-security-risk-compliance-integrated-testing-assessments-remote-at-u-s-bank-2802979383?refId=dgoWN%2B9sLbbjKvV9xyvPzg%3D%3D&trackingId=oa%2B0hzwdY%2FzWVmJBeDbNQQ%3D%3D&position=3&pageNum=0&trk=public_jobs_jserp-result_search-card
|2021-11-13|Community Health Systems|Associate Security Engineer - Incident Response|Franklin, TN|Job Description  Community Health Systems is one of the nation’s leading operators of general acute care hospitals. The organization’s affiliates own, operate or lease 83 hospitals in 16 states with approximately 13,000 licensed beds. Affiliated hospitals are dedicated to providing quality healthcare for local residents and contribute to the economic development of their communities. Based on the unique needs of each community served, these hospitals offer a wide range of diagnostic, medical and surgical services in inpatient and outpatient settings.  Community Health Systems is one of the nation’s leading operators of general acute care hospitals. The organization’s affiliates own, operate or lease 83 hospitals in 16 states with approximately 13,000 licensed beds. Affiliated hospitals are dedicated to providing quality healthcare for local residents and contribute to the economic development of their communities. Based on the unique needs of each community served, these hospitals offer a wide range of diagnostic, medical and surgical services in inpatient and outpatient settings.  CHSPSC, LLC seeks a Associate Security Engineer for its Franklin, TN, headquarters’ Security team.  Summary  As an Associate Security Engineer, you are expected to be a Novice in the responsibilities listed below. You have broad theoretical knowledge, such as knowledge gained through advanced education, but have had limited opportunity to apply this knowledge in a professional setting. You require direct supervision and to accomplish tasks, and rely on documented policies and processes to do your work.  Position Scope  Candidates must be willing to participate in a rotational on-call environment as well as participating in a rotating on call schedule for holidays. The candidate will also demonstrate intuitive problem solving skills and communicate incidents to the appropriate stakeholders for remediation Collaborate in containment, eradication and remediation efforts with the incident response team by detecting, analyzing and performing remediation on attacks that deny the use of authorized applications, network systems or other resources while working in partnership with the constituents that consist of enterprise legal staff, litigation or Ethics and Compliance Accumulate lessons learned documentation from incidents to identify controls to prevent identified malicious activity from reoccurring Analyze network flow data for anomalies and detect malicious network activity and perform network incident investigations to determine the root cause of the security incident and preserving evidence for potential legal action Perform network incident investigations to determine the root cause of the security incident and preserving evidence for potential legal action Partner with technical personnel and additional teams as required in order to contain, eradicate and remediate incidents to drive incidents to closure as part of the incident response life cycle Appropriately inform and advise team members and leadership on incidents and incident prevention Document, communicate, collaborate and transition incident details to other security teams and team members Participate in knowledge sharing with other analysts and develop sound processes and solutions efficiently Participate in attack and penetration testing exercises of company infrastructure and assets to improve and ensure confidentiality, integrity and availability of all company infrastructure and data.  Associated Activities  Gather and maintain chain of custody of digital evidence for legal or HR needs Analyze malware samples for indicators of compromise and lessons learned documentation  Strategic Skills  Innovation, problem solving, and critical thinking skills Ability to work collaboratively to identify and solve problems Great attitude, including developing and maintaining a healthy team environment Effective communicator, including technical documentation  Educational Requirements  High School Dilplom required; Bachelor’s degree preferred or relevant experience. Appropriate industry certification(s) desired  Required  EXPERIENCE REQUIREMENTS:  Common knowledge of typical IT platforms, operating systems, and configuration methods Common knowledge of Security threat tactics and prevention and detection techniques Common knowledge of system administration concepts  Preferred  Experience working with or on a CSIRT or Security Incident Response team Security background, with understanding of SANS Preparation Identification Containment Eradication Recovery Lesson Learned (PICERL) or similar Incident Response methodologies  Job Knowledge  Technical competence in areas listed above. Good critical thinking skills. Strong analytical and problem resolution skills and organizational skills. Strong ability to work on and prioritize multiple, concurrent projects while meeting aggressive deadlines in a fast-paced environment. Willingness to participate in cross-functional training and support. Ability to work independently.  Physical Demands  In order to successfully perform this job, with or without a reasonable accommodation, the following are outlined below:  The Employee is required to read, review, prepare and analyze written data and figures, using a PC or similar, and should possess visual acuity. The Employee may be required to occasionally climb, push, stand, walk, reach, grasp, kneel, stoop, and/or perform repetitive motions. The Employee is not substantially exposed to adverse environmental conditions and; therefore, job functions are typically performed under conditions such as those found within general office or administrative work.|{'Seniority level': 'Not Applicable', 'Employment type': 'Full-time', 'Job function': 'Information Technology', 'Industries': 'Hospitals and Health Care', 'error': ''}|https://www.linkedin.com/jobs/view/associate-security-engineer-incident-response-at-community-health-systems-2798271369?refId=dgoWN%2B9sLbbjKvV9xyvPzg%3D%3D&trackingId=HC6sZhy6uo2sjVwyZXvfzg%3D%3D&position=4&pageNum=0&trk=public_jobs_jserp-result_search-card
