ID|ID_left|Date|Company|Title|Location|Description|Link|ID_right|Seniority level|Employment type|Job function|Industries|error
0|0|2021-11-29|Genpact|Entry level IT Security Analyst|Goodlettsville, TN|Genpact is a professional services firm that creates lasting, impactful transformation. With a startup spirit and 95,000+ curious and courageous minds, we have the expertise to go deep with the world’s biggest brands—and we have fun doing it. Now, we’re calling upon motivated and passionate individuals to drive real world impact for some of the world’s biggest brands. Come, join us in our relentless pursuit of a world that works better for people.  Entry level IT Security Analyst  Responsible for documenting, updating, and maintaining records while utilizing a defined procedure.  Responsibilities  Proven writing/communication skills and experience documenting, updating, and maintaining records while utilizing a defined procedure. Ability to work independently as well as a collaborative member of a team. Demonstrates personal integrity and strong interpersonal skills. Experience in IT Security/GRC is a preferred.  Qualifications  Bachelor’s Degree or Bachelor’s degree in a computer related course of study.  Inviting applications for the role of: - Fresher or Recent Graduate  Please note that this is a contract role providing services to Genpact through our direct sourcing partner, the Ian Martin Group, who manages Genpact’s Contractor Talent Community. If you are selected for this role, you will be employed by Ian Martin and will not be an employee of Genpact.  Genpact is an Equal Opportunity Employer and considers applicants for all positions without regard to race, color, religion or belief, sex, age, national origin, citizenship status, marital status, military/veteran status, genetic information, sexual orientation, gender identity, physical or mental disability or any other characteristic protected by applicable laws. Genpact is committed to creating a dynamic work environment that values diversity and inclusion, respect and integrity, customer focus, and innovation. For more information, visit www.careers.genpact.com|https://www.linkedin.com/jobs/view/entry-level-it-security-analyst-at-genpact-2818950271?refId=vdOlRuzqqb70K5%2BDp8ZfZw%3D%3D&trackingId=ZQmpMwu%2F51wm9%2BvzFKjiKg%3D%3D&position=1&pageNum=0&trk=public_jobs_jserp-result_search-card|0|Associate|Contract|Information Technology|IT Services and IT Consulting|
1|1|2021-11-30|Thorndale Partners|Cyber Security Engineer|La Vergne, TN|DETAILS: Cyber Security Engineer  Title: Cyber Security Engineer  Compensation: $90,000 - $110,000  Start Date: ASAP  Location: Greater Nashville Area     OVERVIEW: Cyber Security Engineer  We are searching for a Cyber Security Engineer to join an IT team that supports an industry-leading organization. The ideal candidate would be in search of a platform to grow and advance in their career as a cyber security professional. We are looking for someone with 5+ years of experience and the desire to be a key member of a team transforming Cyber Security for an industry-leading company. If you have experience leading projects at a large scale, great, however it is not required to be a contributor day one.     MINIMUM REQUIREMENTS: Cyber Security Engineer  Bachelor's Degree or additional relative years of experience 3+ years of engineering experience in networks or systems (Windows or Linux) 2+ years of experience in Information Security at a medium/large size organization Ability to work with scripting and coding languages such as Python, PowerShell, Bash, Ruby, etc.        PREFERRED EXPERIENCE: Cyber Security Engineer  Understanding of business IT needs/requirements and emerging technologies with the ability to relate them to the company' business objectives Experience documenting procedures Experience providing security solutions for virtual environments Experience with incident response methodologies, including collecting and protecting security artifacts Experience automating security controls Understanding of software, database, servers, networking, applications, web application, and remote connectivity security experience Working knowledge of standard compliance frameworks including PCI, SOC2, and ISO 27001 Understanding of Splunk or similar SIEM product Experience with vulnerability management scanning tools Experience working with Varonis or similar data security & thread detection software products Experience monitoring, evaluating and interpreting vulnerabilities, CVEs, remedies, mitigation measures, techniques for escalation, social engineering tactics, phishing techniques, and vulnerability assessments     RESPONSIBILITIES: Cyber Security Engineer  Conducts vulnerability assessments and monitors systems, networks, and databases for possible security breaches and recommends improvements. Research security trends and recommends remediation plans to preemptively eliminate the possibility of a system breach in a complex multi-platform environment. Analyzes business impact and exposure based on emerging security threats, vulnerabilities, and risks and designs security solutions. Understands business IT needs and requirements and emerging technologies and can relate them to the company and its business objectives. Performs security assessments and recommends mitigation strategies or improvements based on security best practices This list is not exhaustive.     Thorndale Partners, LLC  Your trusted talent acquisition partner working to provide a premium experience to both job seekers and hiring managers. We are an Equal Employment Opportunity organization and we do not discriminate against any applicant for employment on the basis of race, color, sex, age, national origin, religion, sexual orientation, gender identity and/or expression, veteran status, disability, or any other federal, state or local protected class.  Please visit our Website and follow us on LinkedIn to learn more.|https://www.linkedin.com/jobs/view/cyber-security-engineer-at-thorndale-partners-2820032551?refId=vdOlRuzqqb70K5%2BDp8ZfZw%3D%3D&trackingId=8wogxJro%2F56Xu8v5T9SxTg%3D%3D&position=2&pageNum=0&trk=public_jobs_jserp-result_search-card|1|Director|Full-time|Information Technology and Analyst|Online Media, Publishing, and Retail|
2|2|2021-11-30|VMware|Threat Analyst I - Opportunity for Working Remotely|Nashville, TN|VMware Carbon Black Managed Detection Threat Analysts are responsible for monitoring and maintaining systems used in our security program. This includes the following of procedures to triage and investigate security alerts, and escalate issues as necessary. Threat Analysts have opportunities for mentorship from more senior members of the team, and involvement with maturing procedures, evaluating new security technologies, incident response, penetration testing, and the freedom to try out new ideas and technologies to improve the SOC.  What You’ll Do  Performs endpoint security monitoring, security event triage, and incident response for VMware Carbon Black customers, coordinates with other team members & management to document and report incidents Threat Analysts will be part of a rotating SOC shift and will need to manage their schedule accordingly so as to ensure there is coverage during SOC shifts Maintains records of security events investigated and incident response activities, utilizing case management and ticketing systems Monitors and analyzes EDR and Security Information and Event Management (SIEM) to identify security issues for remediation Makes recommendations, creates, modifies, and updates EDR and Security Information Event Management (SIEM) tool rules Ensure that we are implementing best practice security policies that address the client's business need while protecting their vital corporate assets Takes on Security Operations responsibilities when not on a SOC shift: This includes but is not limited to documentation, basic malware analysis, exceptions tracking, security tool management, tuning, and configuration, along with metrics and reporting. Be a primary for or support ongoing projects by assisting in the implementation, testing and documentation of security related projects  OS Skills  Technical Skills  Entry to Intermediate skills in Windows, Linux, and/or OSX  Scripting Skills  Experience with any of the following is a plus: Unix Shell scripts, Perl, Python, Powershell, C#, Go  Technology Experience  Firewalls (e.g. PaloAlto Networks, Checkpoint, Cisco ASA, Juniper SSG, PFSense, etc..) Log Management and SIEM (e.g. Splunk, IBM QRadar, HP ArcSight) Network Analysis Tools (e.g. Netwitness, Wireshark) System Analysis and Forensic Tools (e.g. FTK, EnCase) Endpoint Security (e.g. Carbon Black Enterprise Protection, Carbon Black Enterprise Response, Symantec, McAfee, Forefront) Windows Management (e.g. WSUS, SCCM, SCOM, Active Directory, Group Policy Objects,) Penetration Testing Tools (e.g. Metasploit, Backtrack, Kali) Operating Systems (e.g. Windows Server 2008/2012, CentOS Linux, OSX) Enterprise Microsoft Solutions (e.g. Exchange, Sharepoint, Lync) Regulatory Regimes (e.g. ISO27K, SSAE16, HIPPA, PCI, FISMA) Various Open-Source security and networking tools (MRTG, SysInternals, Nagios)  What You’ll Bring  Working towards completion or has a BS/BA degree in Computer Science, Information Systems, or related discipline or equivalent experience. 1 – 3 years of professional work experience in the security field The ideal candidate will have Linux OS and scripting skills. OSX and Windows skills are a plus. Strong analytical skills to define risk, identify potential threats, document and develop action/mitigation plan Strong interpersonal skills, ability to mentor/train staff and bring awareness to current and emerging threats Certifications a Plus: CISSP, SAN GIAC Certifications (GCIH, GPEN, GSEC, etc.) Strong written and verbal communications skills with an ability to present technical risks and issues to non-technical audiences internal and external to the organization  For positions located in Colorado: This position has a salary range starting at $52,000, annually. Bonus, commission, and/or equity may be eligible for this position. Additional benefits for this position can be found at https://benefits.vmware.com/. *Note: Disclosure of Colorado pay and benefits required per sb19-1115  This position is eligible for CarbonBlackUSA referral campaign  Due to the Biden Administration issuing an Executive Order (EO) that effectively mandates COVID-19 vaccination for all U.S. based employees of federal contractors and subcontractors, all U.S. based VMware employees will be required to have their final vaccination dose (e.g., second dose of Pfizer or Moderna, or single dose of J&J) by January 4, 2022. Specifically, this means that all U.S. based VMware employees will need to be fully vaccinated by January 18th, 2022, or by their first date of employment if after that date, subject to legally required accommodations.  Category : Engineering and Technology  Subcategory: Information Security  Experience: Manager and Professional  Full Time/ Part Time: Full Time  Posted Date: 2021-08-25  VMware Company Overview: At VMware, we believe that software has the power to unlock new opportunities for people and our planet. We look beyond the barriers of compromise to engineer new ways to make technologies work together seamlessly. Our cloud, mobility, and security software form a flexible, consistent digital foundation for securely delivering the apps, services and experiences that are transforming business innovation around the globe. At the core of what we do are our people who deeply value execution, passion, integrity, customers, and community. Shape what’s possible today at http://careers.vmware.com.  Equal Employment Opportunity Statement: VMware is an Equal Opportunity Employer and Prohibits Discrimination and Harassment of Any Kind: VMware is committed to the principle of equal employment opportunity for all employees and to providing employees with a work environment free of discrimination and harassment. All employment decisions at VMware are based on business needs, job requirements and individual qualifications, without regard to race, color, religion or belief, national, social or ethnic origin, sex (including pregnancy), age, physical, mental or sensory disability, HIV Status, sexual orientation, gender identity and/or expression, marital, civil union or domestic partnership status, past or present military service, family medical history or genetic information, family or parental status, or any other status protected by the laws or regulations in the locations where we operate. VMware will not tolerate discrimination or harassment based on any of these characteristics. VMware encourages applicants of all ages. Vmware will provide reasonable accommodation to employees who have protected disabilities consistent with local law.|https://www.linkedin.com/jobs/view/threat-analyst-i-opportunity-for-working-remotely-at-vmware-2813533355?refId=vdOlRuzqqb70K5%2BDp8ZfZw%3D%3D&trackingId=G%2BGSI04CPnKD1OBiWV7qmA%3D%3D&position=3&pageNum=0&trk=public_jobs_jserp-result_search-card|2|Not Applicable|Full-time|Information Technology|IT Services and IT Consulting, Computer Software, and Financial Services|
3|3|2021-11-24|Belle|Information Security Analyst|Nashville, TN|About Belle  Belle is a hyper-growth engagement company that is revolutionizing home care -- and it all begins with the feet. With 25M+ U.S. seniors no longer able to reach or see their feet, a lack of self care quietly brings millions to immobility and drives $38B+ in preventable medical spend every year.  The Belle Care Model Has Been Designed To  Through a proprietary clinical-spa foot care service covered by Medicare Advantage, Belle’s Advanced Nail Technicians or “Belle Technicians” play a critical role in the lives of those we serve.  Protect mobility and prevent 75%+ of widespread, costly foot complications; Develop deep, trusted relationships with members; Digitally connect the care team into the home through our regular monthly visits; Identify and resolve whole health issues early (physical, mental and social)  Far more than foot care, our mission is to unite people and their care through joy.  Purpose of this Role  Belle manages highly sensitive, health-related data across tens of thousands of individuals; the Security Analyst is the primary teammate responsible for protecting that data. You will develop, execute, manage and evolve all information security policies and procedures. You will be the first member of our Security function and will report directly to our CTO/CISO. You will be located in Nashville; however, remote work can be considered.  Responsibilities  Manage Belle’s 3rd party security operations provider to ensure reported issues are promptly resolved Continuously improve process and policy to support Belle’s HiTrust certification Implement information security related policies and procedures, including proof of implementation Continuously monitor and audit: policy and procedure review, vendor/partner review, internal HIPAA audits, and risk management practices Document security breaches and assess the damage caused Research security enhancements and make recommendations to management Stay current on IT security trends and news Develop company-wide best practices for technology security Support regular self assessment activities to include penetration testing and vulnerability scanning Be on call to respond to health plan security audit related issues  Experience, Skills, & Personality  Comfortable and enthusiastic when working with policies and procedures and their ongoing management and improvement High standards: independent, self-motivated, results-driven, personable, strong communicator, professional, respectful, willing to learn and improve Empathetic: sensitive to challenges faced by customers, customer service and the entire team in order to identify opportunities for improved efficiency or automation Superb English fluency: clear communication is vital. It goes without saying (but we will say it anyway) that you absolutely must have the ability to participate in frequent video meetings or work in-person Experience in the healthcare field, ideally in a care delivery setting Experience helping an organization obtain HiTrust certification preferred  Preferred Qualifications  Bachelor's degree or equivalent experience in computer science or related field Experience in information security Experience with computer network penetration testing and techniques Understanding of firewalls, proxies, SIEM, antivirus, and IDPS concepts Experience providing strong customer service or owning the technical implementation of customer experience  Benefits  Competitive compensation Health, dental and vision benefits 401k Remote, flexible work: work how/where you are happiest and most productive A great support structure: we are here for you All the resources and tools that you need to succeed Opportunity for significant career growth and expansion of responsibilities Ability to reshape an industry and protect lives|https://www.linkedin.com/jobs/view/information-security-analyst-at-belle-2813045267?refId=vdOlRuzqqb70K5%2BDp8ZfZw%3D%3D&trackingId=cgdioOTNC4nkRAdiPMQVLw%3D%3D&position=4&pageNum=0&trk=public_jobs_jserp-result_search-card|3|Associate|Full-time|Information Technology|Non-profit Organizations, Wellness and Fitness Services, and Hospitals and Health Care|
4|4|2021-11-30|Dollar General|INFORMATION SECURITY ANALYST|Goodlettsville, TN|Dollar General Corporation has been delivering value to shoppers for more than 80 years. Dollar General helps shoppers Save time. Save money. Every day.® by offering products that are frequently used and replenished, such as food, snacks, health and beauty aids, cleaning supplies, basic apparel, housewares and seasonal items at everyday low prices in convenient neighborhood locations. Dollar General operated 17,266 stores in 46 states as of February 26, 2021. Learn more about Dollar General at www.dollargeneral.com.  Responsible for (i) working with the information security management team to support the Company’s information security programs, maintain Sarbanes-Oxley (SOX), HIPAA, and PCI DSS compliance programs, and support a variety of systems and applications, (ii) contributing across a variety of IT projects, and (iii) as a team member, recommending, designing, implementing, supporting, etc. pragmatic information security controls that meet dynamic tactical and strategic information security objectives. Primary focus is governance, risk, and compliance (“GRC”) / integrated risk management (“IRM”) processes, solutions, and support.  Perform or support effective security risk assessments of services, solutions, and vendors by (i) staying current with security risk assessment techniques and trends, (ii) performing independent research to gather and document security posture information; (iii) identifying areas of risk and evaluating for applicability and severity; (iv) tracking, updating, and centrally maintaining identified risk information; (v) identifying and recommending pragmatic risk remediation options; (vi) drafting comprehensive risk assessment reports, and (vii) collaborating with and providing guidance to business owners to ensure identified risks are managed to risk-appropriate remediation, transference, avoidance, or acceptance outcomes. Support defined Company operating principles; help analyze, define, implement, and support efficient business processes related to the information security program; support a variety of security technologies in a hands-on manner; monitor service request queues and provide first tier support to internal customers, owning tickets and driving resolution; use project management best practices to initiate, manage, and close projects; and create and maintain documents related to projects and information security policies, standards, procedures, recommendations, etc. Analyze current and emerging security best practices, and legal and industry regulatory compliance requirements, for applicability. Stay current with associated security and industry trends, best practices, and standards. Examples include PCI DSS, SOX, HIPAA, GDPR, CCPA. Work with the information security management team to support and continuously improve applicable regulatory and internal controls compliance programs, investigate known or suspected security incidents and support internal and external audits. Participate in meetings; build and maintain strong partnerships with multiple departments; participate in vendor support engagements; and other duties as required. Understanding of pragmatic information security controls and holistic defense-in-depth strategies Understanding of current and developing information security technologies and trends Working knowledge of security frameworks such as NIST, ISO 27001, etc. Written and oral communication skills that enable effective communications to appropriate audiences Focus on attention to detail, always leaning toward caution Ability to learn and retain new skills required to adapt to evolving business and technical environments Ability to influence and motivate others Ability to occasionally work during non-standard shifts and in an on-call capacity and be available for occasional travel (up to 5%)  College degree or equivalent experience in information security or computer information systems.  Minimum 1-2 years of information security experience, preferably in the GRC/IRM realm. Hands-on Navex (formerly LockPath) Keylight experience and/or certifications preferred.  Practical working knowledge of GRC/IRM workflow, asset, and process management platforms (e.g., Navex [Lockpath] Keylight, RSA Archer, MetricStream, ServiceNow, etc.), common controls frameworks (e.g., UCF, Adobe CCF, etc.), and threat intelligence platforms, feeds, services.  Experience identifying and addressing security risks associated with host and network operating systems (e.g. Windows, Linux, AIX, AS400, PAN OS, Cisco IOS, etc.); enterprise services (e.g. directory services, email, content management and collaboration, web publishing, database, virtualization, etc.); client-server, thin-client, and web-based applications; enterprise applications (e.g. Lawson); cloud services (e.g. SaaS, IaaS, etc.); data storage, security architecture, network communications technologies and protocols, etc.|https://www.linkedin.com/jobs/view/information-security-analyst-at-dollar-general-2815805368?refId=vdOlRuzqqb70K5%2BDp8ZfZw%3D%3D&trackingId=VjMm4xjLSkLNo39oAVnkVQ%3D%3D&position=5&pageNum=0&trk=public_jobs_jserp-result_search-card|4|Associate|Full-time|Information Technology|Construction, Manufacturing, and Retail|
5|5|2021-10-29|LBMC|Cybersecurity Analyst|Nashville, TN|"LBMC Information Security/CyberMaxx is looking for individuals who are passionate about Security! Do you stay up at night thinking about vulnerabilities and attack scenarios? Do you enjoy working with and leading a team of software security professionals to creatively secure and maintain an enterprise product? If so, LBMC is currently searching for an analyst to work in our 24/7 Security Operations Center (SOC). You will be on the leading edge of analyzing and responding to today's most current cyber-attacks.  DAILY DUTIES  Work as part of a team to deliver services to clients, as well as the following:  First level analysis of real-time intrusion detection (IDS) & log monitoring systems (SIEM) Communication of issues to clients General analysis & reporting of activities   Qualifications  2+ years Information Technology experience required Analytical mindset & aptitude to learn quickly Reliable & willing to work in a 24/7 operations center (shift work required) Solid understanding of core security and infrastructure technologies, such as: firewall, VPN, IDS/IPS/SIEM, Anti-virus, E-mail, DNS, Microsoft OS, & Linux OS Basic understanding of TCP/IP networking, such as: IP addressing, subnet masks, basic IP routing, TCP/UDP   EDUCATION | CERTIFICATIONS  BS degree in Engineering, Computer Science, Information Security, or Information Systems preferred Professional certifications such as Security+, Network+, CCNA   Powered by JazzHR  omE2oamv11"|https://www.linkedin.com/jobs/view/cybersecurity-analyst-at-lbmc-2809742719?refId=vdOlRuzqqb70K5%2BDp8ZfZw%3D%3D&trackingId=jbYNKiZxfmfGbtKsza4Rug%3D%3D&position=6&pageNum=0&trk=public_jobs_jserp-result_search-card|5|Mid-Senior level|Full-time|Information Technology|IT Services and IT Consulting, Financial Services, and Accounting|
